[
  {
    "skill_id": "ai-validation",
    "categories": {
      "readme": 47,
      "requirements": 5,
      "architecture": 5,
      "src": 5,
      "headers": 5,
      "test": 5,
      "build": 5,
      "compliance": 5,
      "validation": 5,
      "docs": 5
    },
    "gaps": [
      "missing requirements/ sub-artifact or equivalent section",
      "missing architecture/ sub-artifact or equivalent section",
      "missing src/ sub-artifact or equivalent section",
      "missing headers/ sub-artifact or equivalent section",
      "missing test/ sub-artifact or equivalent section",
      "missing build/ sub-artifact or equivalent section",
      "missing compliance/ sub-artifact or equivalent section",
      "missing validation/ sub-artifact or equivalent section",
      "missing docs/ sub-artifact or equivalent section"
    ],
    "priority": "high",
    "effort_person_days": 4.5
  },
  {
    "skill_id": "architecture",
    "categories": {
      "readme": 43,
      "requirements": 5,
      "architecture": 5,
      "src": 5,
      "headers": 5,
      "test": 5,
      "build": 5,
      "compliance": 5,
      "validation": 5,
      "docs": 5
    },
    "gaps": [
      "missing requirements/ sub-artifact or equivalent section",
      "missing architecture/ sub-artifact or equivalent section",
      "missing src/ sub-artifact or equivalent section",
      "missing headers/ sub-artifact or equivalent section",
      "missing test/ sub-artifact or equivalent section",
      "missing build/ sub-artifact or equivalent section",
      "missing compliance/ sub-artifact or equivalent section",
      "missing validation/ sub-artifact or equivalent section",
      "missing docs/ sub-artifact or equivalent section"
    ],
    "priority": "high",
    "effort_person_days": 4.6
  },
  {
    "skill_id": "autosar",
    "categories": {
      "readme": 95,
      "requirements": 5,
      "architecture": 5,
      "src": 5,
      "headers": 5,
      "test": 5,
      "build": 5,
      "compliance": 5,
      "validation": 5,
      "docs": 5
    },
    "gaps": [
      "missing requirements/ sub-artifact or equivalent section",
      "missing architecture/ sub-artifact or equivalent section",
      "missing src/ sub-artifact or equivalent section",
      "missing headers/ sub-artifact or equivalent section",
      "missing test/ sub-artifact or equivalent section",
      "missing build/ sub-artifact or equivalent section",
      "missing compliance/ sub-artifact or equivalent section",
      "missing validation/ sub-artifact or equivalent section",
      "missing docs/ sub-artifact or equivalent section"
    ],
    "priority": "high",
    "effort_person_days": 4.3
  },
  {
    "skill_id": "bare-metal",
    "categories": {
      "readme": 44,
      "requirements": 5,
      "architecture": 5,
      "src": 5,
      "headers": 5,
      "test": 5,
      "build": 5,
      "compliance": 5,
      "validation": 5,
      "docs": 5
    },
    "gaps": [
      "missing requirements/ sub-artifact or equivalent section",
      "missing architecture/ sub-artifact or equivalent section",
      "missing src/ sub-artifact or equivalent section",
      "missing headers/ sub-artifact or equivalent section",
      "missing test/ sub-artifact or equivalent section",
      "missing build/ sub-artifact or equivalent section",
      "missing compliance/ sub-artifact or equivalent section",
      "missing validation/ sub-artifact or equivalent section",
      "missing docs/ sub-artifact or equivalent section"
    ],
    "priority": "high",
    "effort_person_days": 4.6
  },
  {
    "skill_id": "bootloader",
    "categories": {
      "readme": 27,
      "requirements": 5,
      "architecture": 5,
      "src": 5,
      "headers": 5,
      "test": 5,
      "build": 5,
      "compliance": 5,
      "validation": 5,
      "docs": 5
    },
    "gaps": [
      "missing requirements/ sub-artifact or equivalent section",
      "missing architecture/ sub-artifact or equivalent section",
      "missing src/ sub-artifact or equivalent section",
      "missing headers/ sub-artifact or equivalent section",
      "missing test/ sub-artifact or equivalent section",
      "missing build/ sub-artifact or equivalent section",
      "missing compliance/ sub-artifact or equivalent section",
      "missing validation/ sub-artifact or equivalent section",
      "missing docs/ sub-artifact or equivalent section"
    ],
    "priority": "high",
    "effort_person_days": 4.6
  },
  {
    "skill_id": "build-system",
    "categories": {
      "readme": 42,
      "requirements": 5,
      "architecture": 5,
      "src": 5,
      "headers": 5,
      "test": 5,
      "build": 5,
      "compliance": 5,
      "validation": 5,
      "docs": 5
    },
    "gaps": [
      "missing requirements/ sub-artifact or equivalent section",
      "missing architecture/ sub-artifact or equivalent section",
      "missing src/ sub-artifact or equivalent section",
      "missing headers/ sub-artifact or equivalent section",
      "missing test/ sub-artifact or equivalent section",
      "missing build/ sub-artifact or equivalent section",
      "missing compliance/ sub-artifact or equivalent section",
      "missing validation/ sub-artifact or equivalent section",
      "missing docs/ sub-artifact or equivalent section"
    ],
    "priority": "high",
    "effort_person_days": 4.6
  },
  {
    "skill_id": "change-impact",
    "categories": {
      "readme": 25,
      "requirements": 5,
      "architecture": 5,
      "src": 5,
      "headers": 5,
      "test": 5,
      "build": 5,
      "compliance": 5,
      "validation": 5,
      "docs": 5
    },
    "gaps": [
      "missing requirements/ sub-artifact or equivalent section",
      "missing architecture/ sub-artifact or equivalent section",
      "missing src/ sub-artifact or equivalent section",
      "missing headers/ sub-artifact or equivalent section",
      "missing test/ sub-artifact or equivalent section",
      "missing build/ sub-artifact or equivalent section",
      "missing compliance/ sub-artifact or equivalent section",
      "missing validation/ sub-artifact or equivalent section",
      "missing docs/ sub-artifact or equivalent section"
    ],
    "priority": "high",
    "effort_person_days": 4.7
  },
  {
    "skill_id": "code-review",
    "categories": {
      "readme": 42,
      "requirements": 5,
      "architecture": 5,
      "src": 5,
      "headers": 5,
      "test": 5,
      "build": 5,
      "compliance": 5,
      "validation": 5,
      "docs": 5
    },
    "gaps": [
      "missing requirements/ sub-artifact or equivalent section",
      "missing architecture/ sub-artifact or equivalent section",
      "missing src/ sub-artifact or equivalent section",
      "missing headers/ sub-artifact or equivalent section",
      "missing test/ sub-artifact or equivalent section",
      "missing build/ sub-artifact or equivalent section",
      "missing compliance/ sub-artifact or equivalent section",
      "missing validation/ sub-artifact or equivalent section",
      "missing docs/ sub-artifact or equivalent section"
    ],
    "priority": "high",
    "effort_person_days": 4.6
  },
  {
    "skill_id": "configuration-management",
    "categories": {
      "readme": 41,
      "requirements": 5,
      "architecture": 5,
      "src": 5,
      "headers": 5,
      "test": 5,
      "build": 5,
      "compliance": 5,
      "validation": 5,
      "docs": 5
    },
    "gaps": [
      "missing requirements/ sub-artifact or equivalent section",
      "missing architecture/ sub-artifact or equivalent section",
      "missing src/ sub-artifact or equivalent section",
      "missing headers/ sub-artifact or equivalent section",
      "missing test/ sub-artifact or equivalent section",
      "missing build/ sub-artifact or equivalent section",
      "missing compliance/ sub-artifact or equivalent section",
      "missing validation/ sub-artifact or equivalent section",
      "missing docs/ sub-artifact or equivalent section"
    ],
    "priority": "high",
    "effort_person_days": 4.6
  },
  {
    "skill_id": "coverage",
    "categories": {
      "readme": 26,
      "requirements": 5,
      "architecture": 5,
      "src": 5,
      "headers": 5,
      "test": 5,
      "build": 5,
      "compliance": 5,
      "validation": 5,
      "docs": 5
    },
    "gaps": [
      "missing requirements/ sub-artifact or equivalent section",
      "missing architecture/ sub-artifact or equivalent section",
      "missing src/ sub-artifact or equivalent section",
      "missing headers/ sub-artifact or equivalent section",
      "missing test/ sub-artifact or equivalent section",
      "missing build/ sub-artifact or equivalent section",
      "missing compliance/ sub-artifact or equivalent section",
      "missing validation/ sub-artifact or equivalent section",
      "missing docs/ sub-artifact or equivalent section"
    ],
    "priority": "high",
    "effort_person_days": 4.6
  },
  {
    "skill_id": "debugging",
    "categories": {
      "readme": 42,
      "requirements": 5,
      "architecture": 5,
      "src": 5,
      "headers": 5,
      "test": 5,
      "build": 5,
      "compliance": 5,
      "validation": 5,
      "docs": 5
    },
    "gaps": [
      "missing requirements/ sub-artifact or equivalent section",
      "missing architecture/ sub-artifact or equivalent section",
      "missing src/ sub-artifact or equivalent section",
      "missing headers/ sub-artifact or equivalent section",
      "missing test/ sub-artifact or equivalent section",
      "missing build/ sub-artifact or equivalent section",
      "missing compliance/ sub-artifact or equivalent section",
      "missing validation/ sub-artifact or equivalent section",
      "missing docs/ sub-artifact or equivalent section"
    ],
    "priority": "high",
    "effort_person_days": 4.6
  },
  {
    "skill_id": "documentation",
    "categories": {
      "readme": 25,
      "requirements": 5,